Question,Option1,Option2,Option3,Option4,Option5,Option6,"Correct Option
(Note:- if correct option is Option1 then insert 1)",Category Name,Marks
main,"2 EC2 Instances in us-west-2a, 2 EC2 Instances in us-west-2b, and 2 EC2
Instances in us-west-2c","3 EC2 Instances in us-west-2a, 3 EC2 Instances in us-west-2b, and no EC2
Instances in us-west-2c","4 EC2 Instances in us-west-2a, 2 EC2 Instances in us-west-2b, and 2 EC2
Instances in us-west-2c","6 EC2 Instances in us-west-2a, 6 EC2 Instances in us-west-2b, and no
EC2 Instances in us-west-2c","3 EC2 Instances in us-west-2a, 3 EC2 Instances in us-west-2b, and 3
EC2 Instances in us-west-2c",,4&5,Multiple,5
second,A Web application using Amazon RDS,A long running worker process,A static website,A management task run once on nightly basis,,,1&2&3,Multiple,5
third,"Modify the Auto Scaling group termination policy to terminate the older
instance first.","Modify the Auto Scaling group termination policy to terminate the newest
instance first.",Modify the Auto Scaling group cool down timers.,Modify the Auto Scaling group to use Scheduled Scaling actions.,"Modify the CloudWatch alarm period that triggers your Auto Scaling
scale down policy",,3&5,Multiple,5
"You currently operate a web application in the AWS US-East region. The application runs on an auto-scaled layer of EC2 instances and an RDS Multi-AZ database. Your IT security compliance officer has tasked you to develop a reliable and durable logging solution to track changes made to your EC2, IAM and RDS resources. The solution must ensure the integrity and confidentiality of your log data. Which of the below solutions would you
recommend?","Create a new CloudTrail trail with one new S3 bucket to store the logs
and with the option that applies trail to all regions selected. Use IAM
roles, S3 bucket policies and Multi Factor Authentication (MFA) to
delete on the S3 bucket that stores your logs.","Create a new CloudTrail with one new S3 bucket to store the logs.
Configure SNS to send log file delivery notifications to your management
system. Use IAM roles and S3 bucket policies on the S3 bucket that stores
your logs.","Create a new CloudTrail trail with an existing S3 bucket to store the logs
and with the option that applies trail to all regions selected. Use S3 ACLs
and Multi Factor Authentication (MFA) to delete on the S3 bucket that
stores your logs","Create three new CloudTrail trails with three new S3 buckets to store the
logs one for the AWS Management console, one for AWS SDKs and one for
command line tools. Use IAM roles and S3 bucket policies on the S3",,,3,Professional,5
