Question,Option1,Option2,Option3,Option4,Option5,Option6,"Correct Option
(Note:- if correct option is Option1 then insert 1)",Category Name,Marks
"For application development and testing purpose, your team has created several EFS
volumes recently. You, as the AWS operation engineer, have been assigned a task to
mount these EFS file systems to EC2 linux instances with encryption enabled in transit.
You have already installed the EFS mount helper in the instances. To use the mount
helper properly to mount the EFS volumes, which actions should you perform? (Select
THREE)","Get that EFS file system's ID from the console or programmatically
through the Amazon EFS API.","Make sure that the security group of EC2 instances has opened the port 443
for SSL traffic.","In your virtual private cloud (VPC) availability zones of EC2 instances,
mount targets are needed to be created first for EFS volumes","In the EC2’s subnets, create a rule in network ACL to allow HTTPS traffic so
that encryption in transit between EC2 and EFS file system is allowed","When the mount helper utility is used, add the encryption option which
is “-o tls”.",,1&3&5,Professional,5
"You are an AWS consultant in an IT company. Your development manager just assigned
you a task to evaluate if the EBS volume types of the EC2 instances were properly
configured in all regions. The major concern that you have found is that almost all EBS
volumes are using the Provisioned IOPS SSD (io1) volume type which costs the company a
lot. You plan to change the volume type from io1 to other types. However, for which
scenarios should you still use the EBS volume type of io1?","A boot volume of a test server which is frequently used by the Quality
Assurance team.","A Cassandra database which needs extremely low latency and high
performance when being processed.","A data warehouse server that contains huge amount of customer data. The
data needs to be accessed and analyzed by a monitor process frequently.","Some large and legacy cold data which is stored to trace customers’
activities in the past. The database requires fewer scans per day",,,2,Professional,5
"An AWS Solutions Architect has noticed that their company is using almost exclusively
EBS General Purpose SSD (gp2) volume types for their EBS volumes. They are considering
modifying the type of some of these volumes, but it is important that performance is not
affected. Which of the following actions could the Solutions Architect consider? (Select
TWO)","A 50GB gp2 root volume can be modified to an EBS Provisioned IOPS
SSD (io1) without stopping the instance.","A gp2 volume that is attached to an instance as a root volume needs can be
modified to a Throughput Optimized HDD (st1) volume.","A 1GB gp2 volume that is attached to an instance as a non-root volume can
be modified to a Cold HDD (sc1) volume.","A 1TB gp2 volume that is attached to an instance as a non-root volume
can be modified to a Throughput Optimized HDD (st1) volume without
stopping the instance or detaching the volume.",,,1&4,Professional,5
"Your team is working on a plant recognition application. After users upload photos of
plants, the application is able to provide their names and properties.
A MySQL database is deployed in EC2 using instance store as instance store-backed
storage is very fast in terms of reads and writes, which makes it optimal for running
MySQL. However, as instance store is an ephemeral volume, the database will be lost
when the instance stops or terminated. How should the team design the disaster recovery
plan for the MySQL database in EC2? (Select TWO)","Back up individual files instead of, or in addition to, backing up the
whole instance store volume to an EBS volume or S3.","Create a new EBS volume and attach the volume to EC2. Migrate the
MySQL database to the EBS volume using some disk management or
migration tool.","In the EC2 AWS console, select the instance -> Actions -> Image -> Create
Image. Then the created AMI is able to backup the MySQL data in the
instance store","Create snapshots for the instance store volume where the MySQL database
resides. Copy the snapshots to other regions for further backup",,,1&2,Professional,5
"A video provider has a big proportion of EC2 instance store volumes as many of their
workloads require super fast disk IO. Compared with EBS counterparts, instance store
volumes are physically attached to the host and have better performance. However, they
still need to work out a suitable method to backup instance store volumes. Are they able
to create AMI as a backup solution?","No. Instance store volume cannot have AMI images which are only
available for EBS volumes","They can only create an AMI using AWS EC2 CLI command for instance
store volumes.","Yes. The AMI can be created by using AWS EC2 console, CLI or SDK for
instance store volumes.","Yes. The AMI CLI tools can be used to create a bundle for the volume
and upload it to S3. Then register the AMI to the file in the S3 bucket. A",,,4,Professional,5
"A media company is working on migrating its various on-premise products and services to
AWS platform. In one web service, MongoDB was used to store user subscription
information. The AWS cloud engineer has migrated this NoSQL database to DynamoDB in
AWS.
He is using Java AWS SDK to implement this. In his log system he has found that a large
number of ProvisionedThroughputExceededException is happening for this DynamoDB
table. How should he troubleshoot the issue and lower down the number of exceptions?
(Select TWO)","In Java AWS SDK, implement a retry mechanism to retry the request when
the exception ProvisionedThroughputExceededException happens.","Open the Amazon CloudWatch console and view performance metrics
for provisioned throughput vs. consumed throughput","In the CloudWatch console and view the
ProvisionedThroughputExceededException metrics to understand when it
happens.","Increase the provisioned read and write capacity and monitor the log
system.",,,2&4,Professional,5
"A large IT company has an on-premise website which provides real-estate information
such as renting, house prices and latest news to users. The website has a Java backend
and a NoSQL MongoDB database that is used to store subscribers data. You are a cloud
analyst and need to migrate the whole application to AWS platform. Your manager
requires that a similar structure should be deployed in AWS.
Moreover, a tracing framework is essential which can record data from both the client
request and the downstream call to the database in AWS. Which AWS services should you
choose to implement the migration?
Select 3 Options","Deploy an autoscaling group of Java backend servers to provide high
availability","Use RDS Aurora as the database for the subscriber data because it is highly
available and can scale up to 15 Read Replicas.","Create a DynamoDB database to hold subscriber data. Set up an
autoscaling policy for the read/write throughp","Use AWS X-Ray SDK to record data about incoming and outgoing
requests. View the statistics graph in X-Ray console","Trace the requests using AWS JAVA SDK and send logs to AWS
CloudWatch Events. Create a CloudWatch dashboard to view the statistics.",,1&3&4,Professional,5
"You work in a video game company and your team is working on a feature that tells how
many times that certain web pages have been viewed or clicked. You also created an
AWS Lambda function to show some key statistics of the data. You tested the Lambda
function and it worked perfectly.
However, your team lead requires you to show the statistics every day at 8:00AM GMT on
a big TV screen so that when employees come in to the office every morning, they have a
rough idea of how the feature runs. What is the most cost efficient and straightforward
way for you to make this happen","Create an AWS CloudWatch Events rule that is scheduled using a cron
expression as “00 08 * * ? *”. Configure the target as the Lambda
function.","Create an Amazon linux EC2 T2 instance and set up a Cron job using
Crontab. Use AWS CLI to call your AWS Lambda every 8:00AM.
] C.","Use Amazon Batch to set up a job with a job definition that runs every
8:00AM for the Lambda function.","In AWS CloudWatch Events console, click “Create Event” using the cron
expression “ * ? * * 08 00”. Configure the target as the Lambda function",,,1,Professional,5
"A company has its major business on selling second-hand products and its online trading
system is deployed on AWS EC2 instances. In Route53, a domain name has been
configured to route the traffic to a Classic Load Balancer. As Classic Load Balancer is quite
old and in AWS there are new types of Load Balancers which Classic Load Balancer can
be easily migrated to, the operation team decides to migrate the Load Balancer. They
want all the connections between clients and EC2 instances be kept secure using
certificates that they created and also want a secure data encryption in transit between
the clients and EC2 instances. Which choices should be used together to meet the needs?
Select 2 Options.","In “Create Load Balancer” console, create an Application Load Balancer and
add a listener with protocol TLS and port 443 so that the TLS connections
terminate at the Load Balancer","Go to the Load Balancer console, create a Network Load Balancer with
a listener that listens to the traffic with protocol as TLS and port as 443.","Create an Application Load Balancer with a listener that listens to the traffic
with protocol as HTTPS and port 80.","For the new Load Balancer, select the target protocol as HTTPS and port as
443, which set up the connections with targets securely","For the new Load Balancer, select the target protocol as TLS and port
as 443. As a result, the connections between Load Balancer and
targets are secure",,2&5,Professional,5
"You are an AWS solutions architect in a large IT company and your company has owned
several AWS accounts. By using IAM roles, the access to resources in other accounts is
granted. For example, users in Test account may switch role and operate on DynamoDB
resources that belong to Dev account.
For training purpose, you are responsible for preparing a document on how to switch roles
properly. Which conditions must be met for IAM users to switch roles successfully across
accounts? (Select TWO)",User is signed in as the AWS account non-root user.,The assuming entity has used multi-factor authentication (MFA) protection,The target account that user plans to switch to must use an alias.,User must be explicitly granted permission to assume the role,,,1&4,Professional,5
"A supermarket chain had a big data analysis system deployed in AWS. The system has the
raw data such as clickstream or process logs in S3. A m3.large EC2 instance transformed
the data to other formats and saved it to another S3 bucket. Amazon Redshift analysed the
data afterwards.
Your team is in charge of improving the system using AWS Glue which is a fully managed
ETL (extract, transform, and load) service. Which tasks can AWS Glue simplify during reestablishing
the big data system? (Select TWO","AWS Glue contains a crawler that connects to the S3 bucket and scans
the dataset. Then the service creates metadata tables in the data
catalog.","AWS Glue automatically generates code in Java to extract data from the
source and transform the data to match the target schema.","Be default, AWS Glue creates a scheduler to trigger the activated tasks
every minute","AWS Glue has a central metadata repository (data catalog). The data in
the catalog is available for analysis immediately",,,1&4,Professional,5
"Your company manages a high-end auctioning site. The members register their products
with the company and manage the actions related to the products. The application is built
using NodeJS and MongoDB. It also uses the Redis to cache the current auctioning data
and pub/sub to distribute the auction related events like bidding count and price
fluctuations.
The engineering team has decided to re-build the part of the bid processing module and
move it to a durable and scalable option instead of using the Redis pub/sub. With the new
design, the management also want the application to support the concurrent bidding,
which is currently limited to just one at a time as the bids need to be processed in order.
The engineering team thinks, after allowing concurrent auctioning, they will need to
support around 12,000-15000 transactions per minute. Please select 2 suitable options to
support the new redesign.",Use the SQS standard queue,"Use the SNS which is similar to the Redis pub/sub but supports unlimited
messages and scales automatically",Create and use the SQS FIFO queue,"Use the SQS FIFO queue with AWS Lambda, migrate the bid processing
module to the Lambda for auto-scaling","Use the auction event data for message group identifier for concurrent
processing within the FIFO queue",,3&5,Professional,5
"A Node.js software team has developed a recipe application that end-users can search
and share recipes. The team deployed the app in AWS EC2 instances with a network loadbalancer. A recent security audit has discovered an issue that the load balancer listener is
using TCP. That means the application is at a security risk and is prone to be threatened by
man in the middle attack. Which below choices are correct to help fix this issue? Select 2.","Modify the listener protocol to TLS and choose an existing certificate in
ACM (AWS Certificate Manager).","Change the listener protocol to HTTPS. Import a new certificate to ACM
(AWS Certificate Manager) and use it in the load balancer listener","Edit the listener by changing the protocol to TLS. Use an existing
certificate from IAM","Modify the listener protocol to SSL and choose an existing certificate in
KMS (AWS Key Management Service).","Edit the listener by changing the protocol to TLS. Upload a new key to
Secret Manager and link the key for the listener to use.",,1&3,Professional,5
"A customer is deploying an SSL enabled Web application on AWS and would like to
implement a separation of roles between the EC2 service administrators that are entitled
to login to Instances as well making API calls and the security officers who will maintain
and have exclusive access to the application's X.509 certificate that contains the private
key. Which configuration option would satisfy the above requirements?","Configure IAM policies authorizing access to the ACM certificate store
only to the security officer's and terminate SSL on the ELB.","Configure system permissions on the web servers to restrict access to the
certificate only to the authorized security officers","Upload the certificate on an S3 bucket owned by the security officers and
accessible only by the EC2 role of the web servers","Configure the web servers to retrieve the certificate upon boot from an
CloudHSM that is managed by the security officers",,,1,Professional,5
"Another team just transferred your team a task to maintain an AWS CodeBuild project that
aims for creating a docker image for the QA lab environment. Previously, this CodeBuild
project was triggered manually at about 20:00 every working day by a QA engineer, which
is not quite appropriate. You are considering setting up an automatic trigger for the project
and at the same time when the job runs, using a SNS topic to notify the team by email.
Which procedures should you use?","Configure a newly created CloudWatch Events rule that have a cron
expression of “0 20 ? * * *”. The targets for the rule include the CodeBuild
project name and the SNS topic.","Create a new CloudWatch Events rule that has a cron expression of “0
20 ? * MON-FRI *”. The targets for this rule are the CodeBuild project
ARN and the SNS topic name","Configure two new CloudWatch Events that have a cron expression of “0
20 ? * MON-FRI *”. The target for the first rule is the CodeBuild project ARN
and the trigger for the second rule is the SNS topic.","As AWS CloudWatch Events rule does not support CodeBuild service, an
EC2 or an on-premise lightweight server is required to schedule the docker
image build of the project. Use a new CloudWatch Events rule to schedule
the SNS notification.",,,2,Professional,5
"Your company runs a customer facing event registration site which is built with a 3-tier
architecture with web and application tier servers, and a MySQL database. The application
requires 6 web tier servers and 6 application tier servers for normal operation, but can run
on a minimum of 65% server capacity and a single MySQL database. When deploying this
application in a region with three availability zones (AZs) which architecture provides high
availability?","A web tier deployed across 2 AZs with 3 EC2 (Elastic Compute Cloud)
instances in each AZ inside an Auto Scaling Group behind an ELB (elastic
load balancer), an application tier deployed across 2 AZs with 3 EC2
instances in each AZ inside an Auto Scaling Group behind an ELB, and one
RDS (Relational Database Service) instance deployed with read replicas in
the other AZ","A web tier deployed across 3 AZs with 2 EC2 (Elastic Compute Cloud)
instances in each AZ inside an Auto Scaling Group behind an ELB (elastic
load balancer), an application tier deployed across 3 AZs with 2 EC2
instances in each AZ inside an Auto Scaling Group behind an ELB, and one
RDS (Relational Database Service) instance deployed with read replicas in
the two other AZs.","A web tier deployed across 2 AZs with 3 EC2 (Elastic Compute Cloud)
instances in each AZ inside an Auto Scaling Group behind an ELB (elastic
load balancer), an application tier deployed across 2 AZs with 3 EC2
instances m each AZ inside an Auto Scaling Group behind an ELB, and a
Multi-AZ RDS (Relational Database Service) deployment","A web tier deployed across 3 AZs with 2 EC2 (Elastic Compute Cloud)
instances in each AZ inside an Auto Scaling Group behind an ELB
(elastic load balancer), an application tier deployed across 3 AZs with
2 EC2 instances in each AZ inside an Auto Scaling Group behind an
ELB, and a Multi-AZ RDS (Relational Database services) deployment",,,4,Professional,5
"Your company has developed a suite of business analytics service as a SaaS application
which is used by hundreds of customers around the world. Recently there has been an
acquisition of a product and the management has decided to integrate the product with
the main service. The product also runs onto the AWS platform. The initial phase required
the product software to use some private resources of the main SaaS service.
The operations team created the Cross Account Role with the required policies and
assigned the role to the account so that they can start using the resources. After a few
days, the operations team found that someone deleted an important S3 bucket from their
production account which has caused the feature disruption across the service.
The management has asked the auditing team to inspect and identify the root cause of
the resource deletion based on the CloudTrail logs. Select the valid options through which
the auditing team can identify who deleted the resources.","Auditing team will need the CloudTrail logs detail of both the SaaS and
the product AWS accounts as the call was made from the product
application’s AWS account"," Auditing team can find the detail only from the SaaS application’s AWS
account, as the bucket was part of that account","Look for the DeleteBucket API record into the SaaS application’s AWS
account CloudTrail logs, it should have a user Id and the bucket detail as
part of the log detail","Look for the sharedEventId and the userIdentity for the DeleteBucket
API event in both the AWS accounts","Look for the sharedEventId and the userIdentity for the AssumeRole API
event in both the AWS accounts",,1&4,Professional,5
"Your company runs a successful medical sampling application onto the AWS cloud and
uses a variety of AWS services like EC2, EBS, S3, DynamoDB, etc. Due to the nature of
their business, they have an internal audit and compliance team which regularly audits the
security posture and takes up various compliance related activities on a strict basis. The
management has decided to also go for an external tool to add-on the internal auditing
process. The management has decided to use a 3rd-party tool which helps them quickly
do the auditing and compliance scanning and generate reports.
The tool needs a way to access the production account and access resources in a readonly
mode. Because there has been no final agreement from the management yet, after
reading through the documentation of the tool, the security team decided to use their
sandbox AWS account and create a cross-account role for all the required policies so that
the tool can access the resources and they can check and verify the reports. The internal
audit team has advised to further secure the cross-account roles so that the role can only
be used by the tool and accidentally not used by any other service to avoid the confused
deputy problem. Your security team says the cross-account role is created with the origin
AWS account number and does not require to further security. Please select 2 valid
options to justify and configure the access.","The security team is correct and you do not need any extra security to
verify the access","The auditing team is correct and you can use the External Id to further
secure the access",Use the OwnerId and ExternalId with the AssumeRole API,Use the ExternalId with the AssumeRole API,You will need to modify the IAM policy to add the ExternalId condition,,2&4,Professional,5
"Your organization has hundreds of developers using AWS accounts. Based on the
organization policy, when a developer joins the company, for development and testing
purpose, a new AWS account is created for that user and added under the AWS
Organisation to manage the billing and other service level policies.
Your accounting team realizes that most recently some extra cost has been coming up to
the organization’s total bill and the cost is coming up from these developer level accounts.
It is possible that either the individual developers are not turning-off their instances after
the use or they are running some software which they are not supposed to run. Select the
process to restrict the usage of the developer accounts so that the overall usage remains
within the company defined policies. Choose 3 correct options","Implement Service Control Policies to whitelist or blacklist different
AWS services depending on the user role.","Use the CloudWatch Events to track the user activity using CloudTrail
events.","Enable the CloudTrail on to the user accounts to track and log user
activities, redirect the logs to the organization wise S3 bucket for
processing.","Run AWS Lambda on individual user accounts to check for malicious
activities.",Assign IAM policies to only allow certain activities.,,1&2&3,Professional,5
"Your company decided to improvise on the current batch processing model and start
using the AWS Batch instead of the currently running SQS and EC2 with Auto Scaling
configurations. Your processing jobs are using a Docker containers and they pull
messages from the AWS SQS queue and writes the data into DynamoDB tables once the
processing is completed. You have created a small Proof-of-concept application to try out
the AWS Batch before you actually migrate your job containers.
As a part of the process, you created the required compute environment, job queue and
the job definition to make sure you have everything you need before you execute your
first job. After submitting a job to the job queue, you realized that the job is stuck in the
RUNNABLE state for a long amount of time. On your local environment, however, the job
runs and completes within the 2 to 5 minutes from start. What could be the possible
causes of the job being stuck into the RUNNABLE state?
Please select 3 correct options.",Make sure the Role assigned to your job has adequate permissions,Make sure Internet Access is available to your container,Make sure CPU and RAM is given as per the compute allocation,Make sure your AWS account has not reached to the EC2 limit,"Make sure the VPC Endpoint is set to access the SQS queue from the
containers inside the VPC",,1&3&4,Professional,5
"Your company runs a business management applications on the AWS cloud and has
hundreds of customers. During the peak load, they receive hundreds of requests per
seconds. The overall application uses a bunch of AWS services like API Gateway, Lambda,
DynamoDB, Kinesis, RDS etc. The product allows the customer and users to customize
their environment based on their requirement and these configurations can be very
complicated.
The product development team is divided into different groups and uses different
programming languages for different parts of the application. Most recently with the
launch of the new releases, the operations teams have started seeing a random decreasein the performance and increase in support tickets being generated. The management
wants to prepare a plan to find out the performance issues and identify them in real-time.
Also if possible, put additional options to group the issues based on the feature or
customer information if possible to figure out high-impact customers. When the issue is
identified the respective team can be reported. Please select two steps to prepare the
tracing system based on the requirements","Publish logs using the CloudWatch Logs and redirect the logs to Kinesis to
inspect the issues in real-time","Because of the distributed nature of the application and multiple services
used, use the 3rd party tool and integrate with the application.","Use X-Ray to monitor the performance of your application
A","Use CloudWatch custom metrics to publish and generate events for the
notifications",Use X-Ray segments and annotations for group level tracing,,3&5,Professional,5
