Question,Option1,Option2,Option3,Option4,Option5,Option6,"Correct Option
(Note:- if correct option is Option1 then insert 1)",Category Name,Marks
"You have an application running on an EC2 Instance which will allow users to download
files from a private S3 bucket using a pre-signed URL. Before generating the URL, the
application should verify the existence of the file in S3. How should the application use
AWS credentials to access the S3 bucket securely?","Use the AWS account access Keys. The application retrieves the
credentials from the source code of the application.","Create an IAM user for the application with permissions that allow list
access to the S3 bucket launch the instance as the IAM user and retrieve
the IAM user’s credentials from the EC2 instance user data.","Create an IAM role for EC2 that allows list access to objects in the S3
bucket. Launch the instance with the role, and retrieve the role’s
credentials from the EC2 Instance metadata","Create an IAM user for the application with permissions that allow list
access to the S3 bucket. The application retrieves the IAM user credentials
from a temporary directory with permissions that allow read access only to
the application user.",,,3,Professional,5
"You are designing a social media site and are considering how to mitigate distributed
denial-of-service (DDoS) attacks. Which of the below are viable mitigation techniques?
Choose 3 options from the below","Add multiple elastic network interfaces (ENIs) to each EC2 instance to
increase the network bandwidth.","Use dedicated instances to ensure that each instance has the maximum
performance possible.","Use an Amazon CloudFront distribution for both static and dynamic
content.","Use an Elastic Load Balancer with Auto Scaling Groups at the
web Application layer restricting direct internet traffic to Amazon
Relational Database Service (RDS) tiers.","Add alert Amazon CloudWatch to look for high network in and CPU
utilization.","Create processes and capabilities to quickly add and remove rules to the
instance OS firewall",3&4&5,Professional,5
"A benefits enrollment company is hosting a 3-tier web application running in a VPC on
AWS which includes a NAT (Network Address Translation) instance in the public Web tier.
There is enough provisioned capacity for the expected workload for the new fiscal year
benefit enrollment period plus some extra overhead. Enrollment proceeds nicely for two
days and then the web tier becomes unresponsive, upon investigation using CloudWatch
and other monitoring tools. It is discovered that there is an extremely large and
unanticipated amount of inbound traffic coming from a set of 15 specific IP addresses over
port 80 from a country where the benefits company has no customers. The web tier
instances are so overloaded that benefit enrolment administrators cannot even SSH into
them. Which activity would be useful in defending against this attack?","Create a custom route table associated with the web tier and block the
attacking IP addresses from the IGW (internet Gateway)","Change the EIP (Elastic IP Address) of the NAT instance in the web tier
subnet and update the Main Route Table with the new EIP","Create 15 Security Group rules to block the attacking IP addresses over
port 80","Create an inbound NACL (Network Access control list) associated with
the web tier subnet with deny rules to block the attacking IP
addresses",,,4,Professional,5
"Your fortune 500 company has undertaken a TCO analysis evaluating the use of Amazon
S3 versus acquiring more hardware. The outcome was that all employees would be
granted access to use Amazon S3 for storage of their personal documents. Which of the
following will you need to consider so you can set up a solution that incorporates single
sign-on from your corporate AD or LDAP directory?
Choose 3 options from the below",Setting up a federation proxy or identity provider,Using AWS Security Token Service to generate temporary tokens,Tagging each folder in the bucket,Configuring IAM role,"Setting up a matching IAM user for every user in your corporate directory
that needs access to a folder in the bucket",,1&2&4,Professional,5
"Your company is getting ready to do a major public announcement of a social media site
on AWS. The website is running on EC2 instances deployed across multiple Availability
Zones with a Multi-AZ RDS MySQL Extra Large DB Instance. The site performs a high
number of small reads and writes per second and relies on an eventual consistency
model. After comprehensive tests, you discover that there is read contention on RDS
MySQL. Which are the best approaches to meet these requirements?
Choose 2 options from the below:","Deploy ElasticCache in-memory cache running in each availability
zone",Implement sharding to distribute load to multiple RDS MySQL instances,Increase the RDS MySQL Instance size and implement provisioned IOPS,Add an RDS MySQL read replica in each availability zone,,,1&4,Professional,5
"A large financial application generates logs in comma separated format and saves to S3
for the processing. After each file is generated a message is sent to SQS from where EC2
picks the message and starts the processing. EC2 instances are running behind load
balancers which are monitoring the SQS queue. Once the processing is completed, the
processed files are stored into another S3 bucket for the reporting purpose. EC2 loads the
application from S3 on the startup. Based on the application release logs, there has been
more than a few releases made to the application last month. The data security and
monitoring team want to check the application logs to make sure the logs are not
revealing any sensitive information. How can you complete this process effectively
without interrupting the auto-scaling or the application release cycle?","Enable CloudTrail and redirect all the system logs to the S3. Download the
log files from S3 and check","Suspend the AutoScaling Terminate process, log into the machines which
have been recently started and check the logs","Install the CloudWatch Logs Agents, redirect the logs to the
CloudWatch. Trigger a Lambda function to process the logs in real
time.","Take daily snapshots of the instances, mount the recent snapshots to
another instance and check the logs",,,3,Professional,5
"You have an existing application which runs on your premise and currently uses a nonrelational
database. Your team has decided to move the application to cloud environment
and also the database to DynamoDB to use some of its features like scaling and data
streaming. As per the management outline, post migration, all the communication
between the application and the DynamoDB must be secure and scalable as the load will
increase in the near future. What combination can be best used to design the migration?
Select two options.",Migrate the on-premise application to the AWS EC2,"Use the HTTPS endpoint of the DynamoDB to make sure all the
communication is secure","Connect your on-premise network to AWS using the VPN to access the
DynamoDB via the VPC endpoints","Run your application using auto-scaling and provision higher read/write
capacity to the DynamoDB tables","Use the VPC gateway endpoint to connect with your DynamoDB,
provide the endpoint to your application configuration","Enable the encryption at rest option to make sure all the data stored in the
DynamoDB is secure",1 & 6,Professional,5
"To follow the new security compliances your company has hired an external auditor to
assess the security perimeter around your SaaS platform. The application is running in
multiple regions and uses the load balancers within each regions for higher availability.
The instances loads sensitive configurations from an S3 bucket at start and the DynamoDB
is used as primary database. The auditor has advised to further tighten the security groups
and NACLs based on the application requirement and use the private network instead of
using the public endpoints to access the AWS services. Your team decided to use the VPC
Endpoints as it uses the AWS internal network for all the communication, after detail
examination they realised the current architecture will not allow them to use the VPC
endpoints as it is and will require a set of modifications. Please select three valid
modifications:","Configure the DynamoDB Global Tables to replicate the data into
multi-regions","Create VPC Endpoints for S3 and DynamoDB and modify the route
tables for all the availability zones used by the auto scaling group","Use the NAT Gateway for all the egress communication to these AWS
services","Setup VPC gateway endpoint for S3 and interface endpoint for DynamoDB
to communicate with these services over the private AWS network","Use the S3 Cross Region Replication to save the configurations in the
multiple regions",,1&2&5,Professional,5
"Your organization is planning to shift one of the high-performance data analytics
application running on Linux servers purchased from the 3rd party vendor to the AWS.
Currently, the application works in an on-premise load balancer and all the data is stored
in a very large shared file system for low-latency and high throughput purpose. The
management wants minimal disruption to existing service and also wants to do stepwise
migration for easy rollback. Please select valid options from below.","Save all the data on S3 and use it as shared storage, use an application load
balancer with EC2 instances to share the processing load","Create a RAID 1 storage using EBS and run the application on EC2 with
application-level load balancers to share the processing load","Use the VPN or Direct Connect to create a link between your company
premise and AWS regional data center","Create an EFS with provisioned throughput and share the storage
between your on-premise instances and EC2 instances","Setup a Route 53 record to distribute the load between on-premise
and AWS load balancer with the weighted routing policy",,3&4&5,Professional,5
"Your solutions architect has asked you to submit an analysis report to help decide
between EFS and S3 as a distributed storage options for the new mobile application. The
application will accept images and videos from the mobile app and will store, enhance,
watermark and deliver to other users. As per the initial research, it seems the EFS will be a
suitable option as the application will be running behind a load balancer and the file
system will be shared among the instances so that the data can be delivered fast. They
have decided to use the CloudFront before the load balancer to geocache the contents
and serve it faster. Under what circumstances EFS will not be best suitable for the current
application design?
Choose 2 Options.","EFS is not redundant and will require periodic backup to ensure no data is
at a loss","The throughput of EFS increases with storage capacity, so the download
will become faster with more data","Your application will have to handle all the upload/download
processing A","Encryption in transit and at the storage level is not available. So in future, if
your application needs encryption, EFS will not the right choice.","EFS performance is dependent on storage size, under heavy load, EFS
may start to throttle unexpectedly",,3 & 5,Professional,5
"Your company runs a popular map service as a SaaS platform. Your application users are
spread across the world but not all of them are using the system heavily, so the load is
high in some of the regions but not all. The application uses the NoSQL database and runs
it on a cluster of EC2 machines and using the custom tools to replicate the data acrossdifferent regions. The current database size is around 10PB and as the popularity of the
application grows, the database is also growing rapidly. Now the application is serving
millions of requests from your SaaS platform. The management has decided to come up
with a plan to re-design the architecture both from the application availability and
infrastructure cost perspective. Please suggest the necessary changes. Select 3 Options.","Route53 with Latency based routing policy to redirect to the nearest
region and deploy the application into regions from where the heavy
load is generating","Migrate the application on S3 and use CloudFront edge locations to serve
the requests","Use DynamoDB global tables to replicate the data into multiple
regions","Deploy the ElastiCache to the regions in which DynamoDB is not
running","Use RDS with the Read Replicas into multiple regions, application servers
will use the read replicas to serve the traffic",,1&3&4,Professional,5
"You have developed a web application to collect monthly expense reports. As the nature
of the application and looking at the usage statistics it is mostly used around the last week
of the month and the first week of the month. To increase the application performance
you added a caching layer in front of the application servers, so the reports are cached
and served immediately. You started off with ElastiCache Redis with a t2 small instance.
The application has been running fine and by looking at the performance activity into the
CloudWatch, the cache hardly hits the 50% of the capacity. You want to minimize the cost
to keep the application running at minimal resources. Please select a valid option to
reduce the cost for the caching layer.","Modify the ElastiCache instance from t2 small to t2 micro, as t2 micro is
more suitable for the given requirement","Create a new ElastiCache instance with t2 micro, and terminate the t2
small instance","Migrate the application to Elastic Beanstalk to use auto-scaling and set the
desired and min capacity to 1, use the RDS and Cache layer of Beanstalk to
save the cost",Run the web application from S3 and serve with CloudFront,,,2,Professional,5
"You are an IT administrator and you are responsible for managing several on-premises
databases in VMware vSphere environments. The R&D team has just created several RDS
instances on VMware to utilize the latest AWS RDS on VMware feature. Then those new
databases can be managed by using RDS console, API and CLI. Which activities does the
Amazon RDS on VMware manage on your behalf? (Select FOUR)","The patching of the RDS on-premises operating systems and database
engines.","Automated multi-availability zone (Multi-AZ) configurations for RDS
instances in Vmware","Online backups based on retention policies of databases in RDS
VMware.","Point-in-time restore from on-premises instances and cloud backups
when needed","IP management such as a dedicated public IP has been allocated by AWS
VPC.",,1&2&3&&4,Professional,5
"You are an AWS solutions architect and are in charge of the maintenance of a RDS on
VMware database which is deployed on-premise. You have created a read replica in apsouth-
1 region to share some read traffic. The system has run smoothly for a while then
the company decides to migrate all the products to AWS including the on-premise RDS
instance. Other than that, the instance needs to have another replica in another region apsoutheast-
1. What actions should you take to fulfill this requirement?","Use Data Migration Service to migrate the on-premise database to a RDS
instance in AWS. Create a read replica in ap-southeast-1 region afterwards.","In RDS console, click “migrating the instance” to create a new RDS instance.
Then create a new read replica in the ap-southeast-1 region","Create another read replica in ap-southeast-1 region to share the read
traffic for the RDS instance on VMware. Promote the RDS read replica in
ap-south-1 to be the new RDS instance so that the original on-premise
database is migrated in AWS with a replica in ap-southeast-1.","Promote the RDS read replica in ap-south-1 to be the new RDS
instance. Create another read replica in ap-southeast-1 for this new
instance",,,4,Professional,5
"You are a development lead and your team has maintained an emailing service for the
company’s major applications. The emailing service is deployed on-premise with several
RDS on VMware databases to store users’ metadata. There is no plan to migrate the onpremise
RDS databases to AWS RDS. However you need an appropriate approach to
backup the databases to AWS so that the database can be quickly restored. Which steps
should you take to fulfill this requirement? (Select THREE)","Specify an automated backup every day to store the snapshot to S3
bucket so that the backup has high availability and durability","Configure a read-replica in the same region as the VPC that the RDS on
VMware instance connects to. Read-replica cannot be created in other
regions","Create an automated backup schedule in RDS and save the daily snapshots
to AWS Glacier for long term backup","Create a read-replica in additional region for disaster recovery as long
as the region supports RDS","Create backups by replicating the RDS on-premise instance to RDS in
AWS.",,1&4&5,Professional,5
"Which of the following are the recommendations from AWS when migrating a legacy
application which is hosted on a virtual machine in an on-premise location?
Choose 2 options from the below:",Use a NAT instance to route traffic from the instance in the VPC.,Use a Static IP address on the VPC instance,"Use entries in Amazon Route 53 that allow the Instance to resolve its
dependencies’ IP addresses on the on-premise location",Use the VM Import facility provided by aws.,,,3&4,Professional,5
"Your team is building up a smart home iOS APP. The end users have used your company’s
camera-equipped home devices such as baby monitors, webcams, and home surveillance
systems. Then the videos are uploaded to AWS Kinesis. Afterwards, through the mobile
APP, users can play the on-demand or live videos using the format of HTTP Live
Streaming (HLS). Which combinations of steps should you use accomplish this task?
(Select TWO)","Create a Kinesis Data Firehose to ingest, durably store and encrypt the live
videos from the users’ home devices.","Create a Kinesis video stream to capture, store, and index the videos
from the camera-equipped home devices.","Transform the stream data to HLS compatible data by using Kinesis Data
Analytics or customer code in EC2/Lambda. Then in the mobile application,
use HLS protocol to display the video stream by using the converted HLS
streaming data.","In the mobile application, use HLS to display the video stream by using
the HLS streaming session URL.",,,2&4,Professional,5
"An IOT company has a new product which is a camera device. The device has installed
several sensors and can record video as required. The device has AWS Kinesis Video
Streams SDK in the software and is able to transmit recorded video in real time to AWS
Kinesis. Then the end users can use a desktop or web client to view, download or share
the video stream. The client app should be simple and use a third-party player such as
Google Shaka Player to display the video stream from Kinesis. How should the client app
be designed?","The client can use HTTP Live Streaming (HLS) for live playback. Use
GetMedia API to process and play Kinesis video streams.","The client can use HLS for live playback. Use
GetHLSStreamingSessionURL API to retrieve the HLS streaming
session URL then provide the URL to the video player.","The client can use Adobe HTTP Dynamic Streaming (HDS) for live playback.
Use GetHDSStreamingSessionURL API to retrieve the HDS streaming
session URL then provide the URL to the video player.","The client can use Microsoft Smooth Streaming (MSS) for live playback.
Use GetMSSStreaming API to retrieve the MSS streaming to the video
player.",,,2,Professional,5
"Kinesis Video Streams can capture massive amounts of live video data from millions of
sources including smartphones, security cameras, webcams, etc. To consume the video in
Kinesis Video Streams, there are two methods. The first is using the GetMedia API and the
second is using HTTP Live Streaming (HLS). For which of the following scenarios HLS
method should be recommended? (Select TWO)","A web application that is able to display the video stream using the
third-party player Video.js.","In order to process Kinesis video streams, a SAAS provider needs to build a
new video player which is integrated into their major online product.","Able to view only live video, not archived video.","Playback video by typing in the HLS streaming session URL in the
location bar of the Apple Safari browser for debug purpose",,,1&4,Professional,5
"When one creates an encrypted EBS volume and attach it to a supported instance type,
which of the following data types are encrypted?
Choose 3 options from the below:",Data at rest inside the volume,All data copied from the EBS volume to S3,All data moving between the volume and the instance,All snapshots created from the volume,,,1&3&4,Professional,5
"You are hired as an AWS solutions architect in a startup company. You notice that there
are some issues for the backup strategy of EC2 instances and there is no snapshot
lifecycle management at all. Users just create snapshots manually without a routine policy
to control. You want to suggest to use a proper EBS Snapshot Lifecycle policy. How would
you persuade your team lead to approve this suggestion? (Select TW","A snapshot lifecycle policy helps to retain backups as required by
auditors or internal complianc","An EBS Snapshot Lifecycle helps to protect valuable data by enforcing
a regular backup schedule","proper snapshot lifecycle policy is able to reduce storage costs as the
snapshots taken by the schedule policy are free","User can design their own schedule to backup snapshots according to
different requirements, such as every 1 week, 2 weeks etc",,,1&2,Professional,5
"A communication company has deployed several EC2 instances in region ap-southeast-1
which are used to monitor user activities. The AWS administrator has configured an EBS
lifecycle policy to create a snapshot every day for each EBS volume to preserve data. The
retention is configured as 5 which means the oldest snapshot will be deleted after 5 days.
The administrator plans to copy some snapshots to another region ap-southeast-2 as
these snapshots contain some important data. Are these new snapshots in the new region
retained with this method?","These new snapshots may be deleted after the retention period as they are
still affected by the retention policy.","These new snapshots can be kept only when they are copied to another
region otherwise they may be deleted by the retention policy. In this case,
the snapshots can be kept","These new snapshots can be kept as the retention schedule is not
carried over to the copy","The new snapshots in region ap-southeast-2 will be deleted after 5 days
unless the delete protection option is enabled",,,3,Professional,5
"An IT company has a big data analytics application that is deployed in EC2 in multiple
availability zones. These EC2 instances simultaneously access a shared Amazon EFS file
system using a traditional file permissions model. A recent internal security audit has
found that there is a potential security risk as the EFS file system is not encrypted for
either at rest or in transit. What actions could be taken to address the potential security
threat posed by non encryption of the EFS volume?","The encryption of data at rest has to be enabled when the Amazon
EFS file system is created. The encryption of data in transit can be
enabled when the file system is mounted in EC2 instance","The encryption of data at rest and in transit can be enabled when the
Amazon EFS file system is created.","The encryption of data at rest and in transit can only be enabled when the
Amazon EFS file system is mounted in EC2 instance.","The encryption of data at rest is able to be enabled when the Amazon EFS
file system is mounted in EC2 instance. The encryption of data in transit is
enabled when the EFS file system is created using AWS console or CLI.",,,1,Professional,5
"An International company has deployed a multi-tier web application that relies on
DynamoDB in a single region. For regulatory reasons they need disaster recovery
capability in a separate region with a Recovery Time Objective of 2 hours and a Recovery
Point Objective of 24 hours. They should synchronize their data on a regular basis and be
able to provision a web application rapidly using CloudFormation. The objective is to
minimize changes to the existing web application, control the throughput of DynamoDB
used for the synchronization of data.
Which design would you choose to meet these requirements?","Use AWS Data Pipeline to schedule a DynamoDB cross region copy once a
day, create a “Last updated” attribute in your DynamoDB table that would
represent the timestamp of the last update and use it as a filter.","Use EMR and write a custom script to retrieve data from DynamoDB in the
current region using a SCAN operation and push it to DynamoDB in the
second region.","Use AWS data pipeline to schedule an export of the DynamoDB table
to S3 in the current region once a day then schedule another task
immediately after it that will import data from S3 to DynamoDB in the
other region.","Send each item into an SQS queue in the second region; use an autoscaling
group behind the SQS queue to replay the write in the second
region.",,,3,Professional,5
